{
  "schema": "skill-selection-vocabulary.v1",
  "intents": {
    "inspect": [
      "inspect",
      "check",
      "kolla"
    ],
    "plan": [
      "plan",
      "design",
      "blueprint"
    ],
    "implement": [
      "implement",
      "implementera",
      "add",
      "build",
      "lägg till",
      "bygg"
    ],
    "fix": [
      "fix",
      "repair",
      "bug",
      "rätta",
      "fixa"
    ],
    "review": [
      "review",
      "audit",
      "granska"
    ],
    "release": [
      "release",
      "publish",
      "tag",
      "släpp"
    ],
    "document": [
      "docs",
      "readme",
      "documentation",
      "dokumentera"
    ]
  },
  "domains": {
    "repo": [
      "repo",
      "repository",
      "repot",
      "mq-agent"
    ],
    "git": [
      "git",
      "branch",
      "commit",
      "merge",
      "pull request",
      "pr"
    ],
    "ci": [
      "ci",
      "test failure"
    ],
    "release": [
      "release",
      "version",
      "tag",
      "changelog"
    ],
    "mcp": [
      "mcp",
      "tool contract"
    ],
    "memory": [
      "memory",
      "obsidian",
      "context card"
    ],
    "runtime": [
      "runtime",
      "process",
      "installed"
    ],
    "security": [
      "secret",
      "credential",
      "public-safe",
      "token"
    ],
    "visual": [
      "image",
      "screenshot",
      "visual"
    ],
    "stack": [
      "mq stack",
      "cross-repo"
    ],
    "feedback": [
      "feedback",
      "activation",
      "canary",
      "rollback",
      "kill switch",
      "policy activation"
    ],
    "contracts": [
      "canonical contract",
      "contract owner",
      "vendored contract",
      "schema drift",
      "canonical schema",
      "vendoring"
    ],
    "recovery": [
      "state snapshot",
      "state restore",
      "disaster recovery",
      "recovery",
      "snapshot",
      "restore"
    ]
  },
  "risks": {
    "repo_write": [
      "implement",
      "implementera",
      "fix",
      "fixa",
      "modify",
      "ändra",
      "bygg",
      "lägg till"
    ],
    "git_write": [
      "commit",
      "branch",
      "merge",
      "pull request",
      "pr"
    ],
    "public_surface": [
      "readme",
      "docs",
      "release",
      "public",
      "publish",
      "pull request",
      "pr"
    ],
    "secret_exposure": [
      "token",
      "credential",
      "secret"
    ],
    "cross_repo": [
      "stack",
      "cross-repo"
    ]
  },
  "max_selected_skills": 5,
  "max_optional_skills": 3
}
